{
  "schemaVersion": 1,
  "replayId": "replay_002",
  "artifactClass": "participant_identity",
  "sourceMethod": "synthetic_participant_identity_mapping",
  "generatedBy": "tools/emit-participant-identity-compact-artifacts.mjs",
  "generatedAt": "task_180",
  "rawDataCaptured": false,
  "fieldValuesCaptured": false,
  "finalFactsProduced": false,
  "gameplayInterpretationProduced": false,
  "playerNamesIncluded": false,
  "heroNamesIncluded": false,
  "teamNamesIncluded": false,
  "entityIdsIncluded": false,
  "mapPositionsIncluded": false,
  "eventRowsIncluded": false,
  "deathEventsEmitted": false,
  "attributionEmitted": false,
  "participantCount": 13,
  "syntheticParticipantKeyPattern": "participant_##",
  "participantIdentityStatus": "available",
  "participants": [
    {
      "participantKey": "participant_01",
      "controllerRefKey": "controller_ref_01",
      "pawnRefKey": "pawn_ref_01",
      "teamRefKey": "team_ref_01",
      "heroRefKey": "hero_ref_08",
      "controllerLinkStatus": "stable",
      "pawnLinkStatus": "stable",
      "teamSignalStatus": "available",
      "heroSignalStatus": "available",
      "lifeStateSignalStatus": "available"
    },
    {
      "participantKey": "participant_02",
      "controllerRefKey": "controller_ref_02",
      "pawnRefKey": "pawn_ref_02",
      "teamRefKey": "team_ref_13",
      "heroRefKey": "hero_ref_03",
      "controllerLinkStatus": "stable",
      "pawnLinkStatus": "stable",
      "teamSignalStatus": "available",
      "heroSignalStatus": "available",
      "lifeStateSignalStatus": "available"
    },
    {
      "participantKey": "participant_03",
      "controllerRefKey": "controller_ref_03",
      "pawnRefKey": "pawn_ref_03",
      "teamRefKey": "team_ref_07",
      "heroRefKey": "hero_ref_07",
      "controllerLinkStatus": "stable",
      "pawnLinkStatus": "stable",
      "teamSignalStatus": "available",
      "heroSignalStatus": "available",
      "lifeStateSignalStatus": "available"
    },
    {
      "participantKey": "participant_04",
      "controllerRefKey": "controller_ref_04",
      "pawnRefKey": "pawn_ref_04",
      "teamRefKey": "team_ref_07",
      "heroRefKey": "hero_ref_13",
      "controllerLinkStatus": "stable",
      "pawnLinkStatus": "stable",
      "teamSignalStatus": "available",
      "heroSignalStatus": "available",
      "lifeStateSignalStatus": "available"
    },
    {
      "participantKey": "participant_05",
      "controllerRefKey": "controller_ref_05",
      "pawnRefKey": "pawn_ref_05",
      "teamRefKey": "team_ref_13",
      "heroRefKey": "hero_ref_02",
      "controllerLinkStatus": "stable",
      "pawnLinkStatus": "stable",
      "teamSignalStatus": "available",
      "heroSignalStatus": "available",
      "lifeStateSignalStatus": "available"
    },
    {
      "participantKey": "participant_06",
      "controllerRefKey": "controller_ref_06",
      "pawnRefKey": "pawn_ref_06",
      "teamRefKey": "team_ref_07",
      "heroRefKey": "hero_ref_04",
      "controllerLinkStatus": "stable",
      "pawnLinkStatus": "stable",
      "teamSignalStatus": "available",
      "heroSignalStatus": "available",
      "lifeStateSignalStatus": "available"
    },
    {
      "participantKey": "participant_07",
      "controllerRefKey": "controller_ref_07",
      "pawnRefKey": "pawn_ref_07",
      "teamRefKey": "team_ref_07",
      "heroRefKey": "hero_ref_01",
      "controllerLinkStatus": "stable",
      "pawnLinkStatus": "stable",
      "teamSignalStatus": "available",
      "heroSignalStatus": "available",
      "lifeStateSignalStatus": "available"
    },
    {
      "participantKey": "participant_08",
      "controllerRefKey": "controller_ref_08",
      "pawnRefKey": "pawn_ref_08",
      "teamRefKey": "team_ref_13",
      "heroRefKey": "hero_ref_10",
      "controllerLinkStatus": "stable",
      "pawnLinkStatus": "stable",
      "teamSignalStatus": "available",
      "heroSignalStatus": "available",
      "lifeStateSignalStatus": "available"
    },
    {
      "participantKey": "participant_09",
      "controllerRefKey": "controller_ref_09",
      "pawnRefKey": "pawn_ref_09",
      "teamRefKey": "team_ref_07",
      "heroRefKey": "hero_ref_09",
      "controllerLinkStatus": "stable",
      "pawnLinkStatus": "stable",
      "teamSignalStatus": "available",
      "heroSignalStatus": "available",
      "lifeStateSignalStatus": "available"
    },
    {
      "participantKey": "participant_10",
      "controllerRefKey": "controller_ref_10",
      "pawnRefKey": "pawn_ref_10",
      "teamRefKey": "team_ref_13",
      "heroRefKey": "hero_ref_11",
      "controllerLinkStatus": "stable",
      "pawnLinkStatus": "stable",
      "teamSignalStatus": "available",
      "heroSignalStatus": "available",
      "lifeStateSignalStatus": "available"
    },
    {
      "participantKey": "participant_11",
      "controllerRefKey": "controller_ref_11",
      "pawnRefKey": "pawn_ref_11",
      "teamRefKey": "team_ref_13",
      "heroRefKey": "hero_ref_05",
      "controllerLinkStatus": "stable",
      "pawnLinkStatus": "stable",
      "teamSignalStatus": "available",
      "heroSignalStatus": "available",
      "lifeStateSignalStatus": "available"
    },
    {
      "participantKey": "participant_12",
      "controllerRefKey": "controller_ref_12",
      "pawnRefKey": "pawn_ref_12",
      "teamRefKey": "team_ref_13",
      "heroRefKey": "hero_ref_06",
      "controllerLinkStatus": "stable",
      "pawnLinkStatus": "stable",
      "teamSignalStatus": "available",
      "heroSignalStatus": "available",
      "lifeStateSignalStatus": "available"
    },
    {
      "participantKey": "participant_13",
      "controllerRefKey": "controller_ref_13",
      "pawnRefKey": "pawn_ref_13",
      "teamRefKey": "team_ref_07",
      "heroRefKey": "hero_ref_12",
      "controllerLinkStatus": "stable",
      "pawnLinkStatus": "stable",
      "teamSignalStatus": "available",
      "heroSignalStatus": "available",
      "lifeStateSignalStatus": "available"
    }
  ],
  "teamPartition": {
    "teamPartitionStatus": "available",
    "teamRefCount": 3,
    "participantsWithTeamSignal": 13
  },
  "heroCoverage": {
    "heroCoverageStatus": "available",
    "participantsWithHeroSignal": 13
  },
  "timeFoundation": {
    "tickProgressionObserved": true,
    "timeNormalizationStatus": "available",
    "normalizedTimeBaseAvailable": true,
    "perEventTicksEmitted": false,
    "perEventTimestampsEmitted": false
  },
  "lifeStateFoundation": {
    "deathCounterCoverageStatus": "available",
    "aliveDeadSignalCoverageStatus": "available",
    "respawnSignalCoverageStatus": "available",
    "readyForAliveDeadRespawnArtifact": true
  },
  "deathValidationBridge": {
    "deathValidationArtifactFound": true,
    "eventCount": 53,
    "eventCountMeaning": "source_observed_counter_transition_candidate_count_not_final_death_fact",
    "canUseAsDeathEventSourceAlone": false
  },
  "readiness": {
    "readyForParticipantIdentityConsumption": true,
    "readyForAliveDeadRespawnArtifact": true,
    "readyForCanonicalDeathEventDesign": false,
    "readyForAttribution": false,
    "readyForTeamfightDetection": false
  },
  "limitations": [
    "Participant, controller, pawn, team, and hero refs are synthetic and replay-local; raw source values are not persisted.",
    "This artifact emits no player names, hero names, team names, raw IDs, handles, slots, field values, positions, or event rows.",
    "deathValidationBridge.eventCount is a source-observed counter-transition candidate count, not a final death fact.",
    "Canonical death events, attribution, teamfight detection, and gameplay interpretation remain unauthorized."
  ]
}
